{
  "schema_version": 1,
  "message_id": "0192f4c1-2b3c-7d4e-9f50-6a7b8c9d0e1f",
  "message_type": "project.generation_cancelled.v1",
  "occurred_at": "2026-10-24T10:30:00Z",
  "correlation_id": "0192f4a9-0000-7aaa-8bbb-cccccccccccc",
  "project_id": "5f0c2a8e-7c1b-4d2e-9a3f-1b2c3d4e5f60",
  "generation_request_id": "0192f4a9-0000-7aaa-8bbb-cccccccccccc"
}
